<?xml version="1.0" encoding="UTF-8"?>
<schema xmlns="http://www.w3.org/2001/XMLSchema" 
	targetNamespace="http://www.esei.uvigo.es/dai/proyecto"
	xmlns:tns="http://www.esei.uvigo.es/dai/proyecto">
	<element name="collection">
		<complexType>
			<sequence>
				<element name="disc" type="tns:disc" minOccurs="0" maxOccurs="unbounded"/>
				<element name="movie" type="tns:movie" minOccurs="0" maxOccurs="unbounded"/>
				<element name="book" type="tns:book" minOccurs="0" maxOccurs="unbounded"/>
			</sequence>
		</complexType>
	</element>

    <complexType name="item">
    	<sequence>
    		<element name="name" type="string"/>
    	</sequence>
   		<attribute name="year" type="unsignedInt"/>
    </complexType>

    <complexType name="disc">
    	<complexContent>
    		<extension base="tns:item">
    			<sequence>
    				<element name="genre" type="string"/>
    				<element name="artist" type="string"/>
    			</sequence>
    		</extension>
    	</complexContent>
    </complexType>

    <complexType name="movie">
    	<complexContent>
    		<extension base="tns:item">
    			<sequence>
    				<element name="genre" type="string"/>
    				<element name="director" type="string"/>
    			</sequence>
    		</extension>
    	</complexContent>
    </complexType>

    <complexType name="book">
    	<complexContent>
    		<extension base="tns:item">
    			<sequence>
    				<element name="genre" type="string"/>
    				<element name="author" type="string"/>
    				<element name="pages" type="unsignedInt"/>
    			</sequence>
    		</extension>
    	</complexContent>
    </complexType>
</schema>